{
  "$schema": "./ServerPresentationExclusions.schema.json",
  "SchemaVersion": 1,
  "Description": "三服务器配置的纯表现排除真源。CookDirectories生成NeverCook及对应外置Actor/对象路径；StageOnlyDirectories保持既有专服收据剥离范围。规则不证明Cook或运行通过。",
  "Profiles": {
    "DedicatedServer": "Game/Config/Custom/DedicatedServer/DefaultGame.ini",
    "VillageServer": "Game/Config/Custom/VillageServer/DefaultGame.ini",
    "VillageDevelopmentServer": "Game/Config/Custom/VillageDevelopmentServer/DefaultGame.ini"
  },
  "CookConfigProfiles": {
    "DedicatedServer": "DedicatedServer",
    "VillageServer": "VillageServer",
    "VillageDevelopmentServer": "VillageDevelopmentServer",
    "FoundationStandalone": "DedicatedServer"
  },
  "CookDirectories": [
    {
      "PackagePath": "/DBAWorldPack_Village/Water/Blueprints",
      "SourceDirectory": "Game/Plugins/DivineBeasts/ContentPacks/Worlds/DBAWorldPack_Village/Content/Water/Blueprints",
      "Profiles": "AllServers",
      "Availability": "Present",
      "Reason": "本目录三项湖泊、河流、瀑布视觉预设硬引用纯Surface/VFX资源，不提供GamePlatformWaterRuntime的权威水域定义；当前地图未通过这些预设提供权威几何。权威Region与地图不得迁入本纯表现目录。"
    },
    {
      "PackagePath": "/GamePlatformVFX/Water",
      "SourceDirectory": "Game/Plugins/GamePlatform/Presentation/GamePlatformVFX/Content/Water",
      "Profiles": "AllServers",
      "Availability": "Present",
      "Reason": "涟漪、瀑布水雾及纯表现蓝图只由客户端VFX播放；不承担权威水域采样、碰撞或导航。Stage整包剥离不能替代Cook阶段排除。"
    },
    {
      "PackagePath": "/DBAWorldPack_Village/Water/Materials",
      "SourceDirectory": "Game/Plugins/DivineBeasts/ContentPacks/Worlds/DBAWorldPack_Village/Content/Water/Materials",
      "Profiles": "AllServers",
      "Availability": "Present",
      "Reason": "湖泊、河流、瀑布与泡沫的项目材质实例仅引用客户端Surface材质；只排除材质叶子，不排除Village地图、权威水域蓝图或GamePlatformWaterRuntime。"
    },
    {
      "PackagePath": "/DBAWorldPack_Village/Water/Textures",
      "SourceDirectory": "Game/Plugins/DivineBeasts/ContentPacks/Worlds/DBAWorldPack_Village/Content/Water/Textures",
      "Profiles": "AllServers",
      "Availability": "Present",
      "Reason": "水下焦散的湖岸遮罩纹理仅由客户端水下材质采样；权威物理水域保存于地图Brush，不读取纹理。"
    },
    {
      "PackagePath": "/Game/Development/PluginDemos",
      "SourceDirectory": "Game/Content/Development/PluginDemos",
      "Profiles": "AllServers",
      "Availability": "Present",
      "Reason": "SSLM开发演示门户、旧兼容Widget及诊断资源；不含服务器权威，不进入三角色专服Cook。新UI内容包已由DBAUIPack_Core整包排除。"
    },
    {
      "PackagePath": "/Game/Development/BirdFlock",
      "SourceDirectory": "Game/Content/Development/BirdFlock",
      "Profiles": "AllServers",
      "Availability": "Present",
      "Reason": "鸟群GPU/场景样板地图与开发夹具，不参与专服权威；演示接线不改变正式服务器世界内容。"
    },
    {
      "PackagePath": "/Game/Development/MaterialLibrary",
      "SourceDirectory": "Game/Content/Development/MaterialLibrary",
      "Profiles": "AllServers",
      "Availability": "Present",
      "Reason": "材质函数开发审核蓝图、母材质与四类演示地图；必须从正式客户端和三种专用服务器Cook排除，正式Game/Development目录无权威逻辑。"
    },
    {
      "PackagePath": "/GamePlatformVFX/Materials/Functions",
      "SourceDirectory": "Game/Plugins/GamePlatform/Presentation/GamePlatformVFX/Content/Materials/Functions",
      "Profiles": "AllServers",
      "Availability": "Present",
      "Reason": "新增VFX共用MaterialFunction纯视觉资产，仅客户端Niagara与表现材质消费，不参与服务端权威行为。"
    },
    {
      "PackagePath": "/GamePlatformUI/Materials/Functions",
      "SourceDirectory": "Game/Plugins/GamePlatform/Presentation/GamePlatformUI/Content/Materials/Functions",
      "Profiles": "AllServers",
      "Availability": "Present",
      "Reason": "UI专用材质函数属于客户端UserInterface材质域，不应被Server Cook并入。"
    },
    {
      "PackagePath": "/DBAPresentationPack_Core/VFX/IceArrow",
      "SourceDirectory": "Game/Plugins/DivineBeasts/ContentPacks/Presentation/DBAPresentationPack_Core/Content/VFX/IceArrow",
      "Profiles": "AllServers",
      "Availability": "Present",
      "Reason": "SSLM寒冰箭项目专属纹理、冰晶网格、材质、Niagara系统及视觉定义仅由客户端播放；服务器保留原有GAS和权威弹体，不得Cook纯表现资产。"
    },
    {
      "PackagePath": "/DBAPresentationPack_Core/VFX/DevelopmentMagic",
      "SourceDirectory": "Game/Plugins/DivineBeasts/ContentPacks/Presentation/DBAPresentationPack_Core/Content/VFX/DevelopmentMagic",
      "Profiles": "AllServers",
      "Availability": "Present",
      "Reason": "开发火焰/冰箭/奥术纯Niagara、材质及定义；碰撞/伤害由平台权威投射物，不进任何专服。"
    },
    {
      "PackagePath": "/DBAUIPack_Core",
      "SourceDirectory": "Game/Plugins/DivineBeasts/ContentPacks/Presentation/DBAUIPack_Core/Content",
      "Profiles": "AllServers",
      "Availability": "Present",
      "Reason": "已确认纯客户端界面或VFX资源，不承担服务器玩法权威。"
    },
    {
      "PackagePath": "/DBAFrontEndPack",
      "SourceDirectory": "Game/Plugins/DivineBeasts/ContentPacks/Presentation/DBAFrontEndPack/Content",
      "Profiles": "AllServers",
      "Availability": "Present",
      "Reason": "已确认纯客户端界面或VFX资源，不承担服务器玩法权威。"
    },
    {
      "PackagePath": "/DBAHeroPack_Rat/UI/Abilities",
      "SourceDirectory": "Game/Plugins/DivineBeasts/ContentPacks/Heroes/DBAHeroPack_Rat/Content/UI/Abilities",
      "Profiles": "AllServers",
      "Availability": "Present",
      "Reason": "纯客户端英雄图标或肖像；权威HeroDefinition归DBAGameplay。"
    },
    {
      "PackagePath": "/DBAHeroPack_Ox/UI/Abilities",
      "SourceDirectory": "Game/Plugins/DivineBeasts/ContentPacks/Heroes/DBAHeroPack_Ox/Content/UI/Abilities",
      "Profiles": "AllServers",
      "Availability": "Present",
      "Reason": "纯客户端英雄图标或肖像；权威HeroDefinition归DBAGameplay。"
    },
    {
      "PackagePath": "/DBAHeroPack_Tiger/UI/Abilities",
      "SourceDirectory": "Game/Plugins/DivineBeasts/ContentPacks/Heroes/DBAHeroPack_Tiger/Content/UI/Abilities",
      "Profiles": "AllServers",
      "Availability": "Present",
      "Reason": "纯客户端英雄图标或肖像；权威HeroDefinition归DBAGameplay。"
    },
    {
      "PackagePath": "/DBAHeroPack_Rabbit/UI/Abilities",
      "SourceDirectory": "Game/Plugins/DivineBeasts/ContentPacks/Heroes/DBAHeroPack_Rabbit/Content/UI/Abilities",
      "Profiles": "AllServers",
      "Availability": "Present",
      "Reason": "纯客户端英雄图标或肖像；权威HeroDefinition归DBAGameplay。"
    },
    {
      "PackagePath": "/DBAHeroPack_Dragon/UI/Abilities",
      "SourceDirectory": "Game/Plugins/DivineBeasts/ContentPacks/Heroes/DBAHeroPack_Dragon/Content/UI/Abilities",
      "Profiles": "AllServers",
      "Availability": "Present",
      "Reason": "纯客户端英雄图标或肖像；权威HeroDefinition归DBAGameplay。"
    },
    {
      "PackagePath": "/DBAHeroPack_Snake/UI/Abilities",
      "SourceDirectory": "Game/Plugins/DivineBeasts/ContentPacks/Heroes/DBAHeroPack_Snake/Content/UI/Abilities",
      "Profiles": "AllServers",
      "Availability": "Present",
      "Reason": "纯客户端英雄图标或肖像；权威HeroDefinition归DBAGameplay。"
    },
    {
      "PackagePath": "/DBAHeroPack_Horse/UI/Abilities",
      "SourceDirectory": "Game/Plugins/DivineBeasts/ContentPacks/Heroes/DBAHeroPack_Horse/Content/UI/Abilities",
      "Profiles": "AllServers",
      "Availability": "Present",
      "Reason": "纯客户端英雄图标或肖像；权威HeroDefinition归DBAGameplay。"
    },
    {
      "PackagePath": "/DBAHeroPack_Goat/UI/Abilities",
      "SourceDirectory": "Game/Plugins/DivineBeasts/ContentPacks/Heroes/DBAHeroPack_Goat/Content/UI/Abilities",
      "Profiles": "AllServers",
      "Availability": "Present",
      "Reason": "纯客户端英雄图标或肖像；权威HeroDefinition归DBAGameplay。"
    },
    {
      "PackagePath": "/DBAHeroPack_Monkey/UI/Abilities",
      "SourceDirectory": "Game/Plugins/DivineBeasts/ContentPacks/Heroes/DBAHeroPack_Monkey/Content/UI/Abilities",
      "Profiles": "AllServers",
      "Availability": "Present",
      "Reason": "纯客户端英雄图标或肖像；权威HeroDefinition归DBAGameplay。"
    },
    {
      "PackagePath": "/DBAHeroPack_Rooster/UI/Abilities",
      "SourceDirectory": "Game/Plugins/DivineBeasts/ContentPacks/Heroes/DBAHeroPack_Rooster/Content/UI/Abilities",
      "Profiles": "AllServers",
      "Availability": "Present",
      "Reason": "纯客户端英雄图标或肖像；权威HeroDefinition归DBAGameplay。"
    },
    {
      "PackagePath": "/DBAHeroPack_Dog/UI/Abilities",
      "SourceDirectory": "Game/Plugins/DivineBeasts/ContentPacks/Heroes/DBAHeroPack_Dog/Content/UI/Abilities",
      "Profiles": "AllServers",
      "Availability": "Present",
      "Reason": "纯客户端英雄图标或肖像；权威HeroDefinition归DBAGameplay。"
    },
    {
      "PackagePath": "/DBAHeroPack_Boar/UI/Abilities",
      "SourceDirectory": "Game/Plugins/DivineBeasts/ContentPacks/Heroes/DBAHeroPack_Boar/Content/UI/Abilities",
      "Profiles": "AllServers",
      "Availability": "Present",
      "Reason": "纯客户端英雄图标或肖像；权威HeroDefinition归DBAGameplay。"
    },
    {
      "PackagePath": "/GamePlatformVFX/Weather",
      "SourceDirectory": "Game/Plugins/GamePlatform/Presentation/GamePlatformVFX/Content/Weather",
      "Profiles": "AllServers",
      "Availability": "Present",
      "Reason": "已确认纯客户端界面或VFX资源，不承担服务器玩法权威。"
    },
    {
      "PackagePath": "/GamePlatformVFX/Environment/BirdFlock",
      "SourceDirectory": "Game/Plugins/GamePlatform/Presentation/GamePlatformVFX/Content/Environment/BirdFlock",
      "Profiles": "AllServers",
      "Availability": "Present",
      "Reason": "已确认纯客户端界面或VFX资源，不承担服务器玩法权威。"
    },
    {
      "PackagePath": "/DBAPresentationPack_Core/VFX/Environment/BirdFlock",
      "SourceDirectory": "Game/Plugins/DivineBeasts/ContentPacks/Presentation/DBAPresentationPack_Core/Content/VFX/Environment/BirdFlock",
      "Profiles": "AllServers",
      "Availability": "Present",
      "Reason": "已确认纯客户端界面或VFX资源，不承担服务器玩法权威。"
    },
    {
      "PackagePath": "/GamePlatformVFX/Environment/Fauna",
      "SourceDirectory": "Game/Plugins/GamePlatform/Presentation/GamePlatformVFX/Content/Environment/Fauna",
      "Profiles": "AllServers",
      "Availability": "Present",
      "Reason": "已确认纯客户端界面或VFX资源，不承担服务器玩法权威。"
    },
    {
      "PackagePath": "/DBAPresentationPack_Core/VFX/Environment/Fauna",
      "SourceDirectory": "Game/Plugins/DivineBeasts/ContentPacks/Presentation/DBAPresentationPack_Core/Content/VFX/Environment/Fauna",
      "Profiles": "AllServers",
      "Availability": "Present",